{
  "$schema": "https://json-schema.org/draft/2020-12/schema",
  "$id": "https://flowly.local/contracts/schemas/recurring-rule.schema.json",
  "title": "RecurringRule",
  "description": "Calendar-aware recurring transaction template. Occurrence generation is delivered in Phase 7.",
  "type": "object",
  "additionalProperties": false,
  "required": [
    "formatVersion",
    "id",
    "name",
    "template",
    "frequency",
    "interval",
    "startDate",
    "active",
    "createdAt",
    "updatedAt"
  ],
  "properties": {
    "formatVersion": { "const": 1 },
    "id": { "type": "string", "format": "uuid" },
    "name": { "type": "string", "minLength": 1, "maxLength": 80 },
    "template": {
      "type": "object",
      "additionalProperties": false,
      "required": ["accountId", "amountMinor", "currency"],
      "properties": {
        "accountId": { "type": "string", "format": "uuid" },
        "amountMinor": { "type": "integer" },
        "currency": { "type": "string", "pattern": "^[A-Z]{3}$" },
        "payee": { "type": "string", "maxLength": 120 },
        "userNote": { "type": "string", "maxLength": 2000 },
        "tagIds": {
          "type": "array",
          "uniqueItems": true,
          "items": { "type": "string", "format": "uuid" }
        }
      }
    },
    "frequency": { "enum": ["daily", "weekly", "monthly", "yearly"] },
    "interval": { "type": "integer", "minimum": 1, "maximum": 60 },
    "startDate": { "type": "string", "format": "date" },
    "endDate": { "type": "string", "format": "date" },
    "nextDueDate": { "type": "string", "format": "date" },
    "active": { "type": "boolean" },
    "createdAt": { "type": "string", "format": "date-time" },
    "updatedAt": { "type": "string", "format": "date-time" }
  }
}
