{
  "formatVersion": 1,
  "id": "018f2c1e-6d5b-7c3a-9f2e-6c4d5e6f7081",
  "name": "Rent",
  "template": {
    "accountId": "018f2c1e-6d5b-7c3a-9f2e-1a2b3c4d5e6f",
    "amountMinor": -95000,
    "currency": "EUR",
    "payee": "Landlord"
  },
  "frequency": "monthly",
  "interval": 1,
  "startDate": "2026-10-31",
  "nextDueDate": "2026-10-31",
  "active": true,
  "createdAt": "2026-09-01T08:00:00.000Z",
  "updatedAt": "2026-09-01T08:00:00.000Z"
}
